
Bus 001 Device 011: ID 0b8c:0061  
Device Descriptor:
  bLength                18
  bDescriptorType         1
  bcdUSB               2.00
  bDeviceClass            0 
  bDeviceSubClass         0 
  bDeviceProtocol         0 
  bMaxPacketSize0         8
  idVendor           0x0b8c 
  idProduct          0x0061 
  bcdDevice            1.3a
  iManufacturer           1 SMART Technologies
  iProduct                2 SMART Board Interactive Whiteboard - 600 Series
  iSerial                 3 T1210000000832-F
  bNumConfigurations      1
  Configuration Descriptor:
    bLength                 9
    bDescriptorType         2
    wTotalLength       0x0029
    bNumInterfaces          1
    bConfigurationValue     1
    iConfiguration          0 
    bmAttributes         0xa0
      (Bus Powered)
      Remote Wakeup
    MaxPower              300mA
    Interface Descriptor:
      bLength                 9
      bDescriptorType         4
      bInterfaceNumber        0
      bAlternateSetting       0
      bNumEndpoints           2
      bInterfaceClass         3 
      bInterfaceSubClass      0 
      bInterfaceProtocol      0 
      iInterface              0 
        HID Device Descriptor:
          bLength                 9
          bDescriptorType        33
          bcdHID               1.11
          bCountryCode            0 Not supported
          bNumDescriptors         1
          bDescriptorType        34 Report
          wDescriptorLength      90
          Report Descriptor: (length is 90)
            Item(Global): Usage Page, data= [ 0x01 ] 1
                            Generic Desktop Controls
            Item(Local ): Usage, data= [ 0x02 ] 2
                            Mouse
            Item(Main  ): Collection, data= [ 0x01 ] 1
                            Application
            Item(Global): Report ID, data= [ 0x01 ] 1
            Item(Local ): Usage, data= [ 0x01 ] 1
                            Pointer
            Item(Main  ): Collection, data= [ 0x00 ] 0
                            Physical
            Item(Global): Usage Page, data= [ 0x09 ] 9
                            Buttons
            Item(Local ): Usage Minimum, data= [ 0x01 ] 1
                            Button 1 (Primary)
            Item(Local ): Usage Maximum, data= [ 0x03 ] 3
                            Button 3 (Tertiary)
            Item(Global): Logical Minimum, data= [ 0x00 ] 0
            Item(Global): Logical Maximum, data= [ 0x01 ] 1
            Item(Global): Report Count, data= [ 0x03 ] 3
            Item(Global): Report Size, data= [ 0x01 ] 1
            Item(Main  ): Input, data= [ 0x02 ] 2
                            Data Variable Absolute No_Wrap Linear
                            Preferred_State No_Null_Position Non_Volatile Bitfield
            Item(Global): Report Count, data= [ 0x01 ] 1
            Item(Global): Report Size, data= [ 0x05 ] 5
            Item(Main  ): Input, data= [ 0x01 ] 1
                            Constant Array Absolute No_Wrap Linear
                            Preferred_State No_Null_Position Non_Volatile Bitfield
            Item(Global): Usage Page, data= [ 0x01 ] 1
                            Generic Desktop Controls
            Item(Local ): Usage, data= [ 0x30 ] 48
                            Direction-X
            Item(Local ): Usage, data= [ 0x31 ] 49
                            Direction-Y
            Item(Global): Logical Minimum, data= [ 0x00 ] 0
            Item(Global): Logical Maximum, data= [ 0xff 0x07 ] 2047
            Item(Global): Physical Minimum, data= [ 0x00 ] 0
            Item(Global): Physical Maximum, data= [ 0xff 0x07 ] 2047
            Item(Global): Report Size, data= [ 0x0c ] 12
            Item(Global): Report Count, data= [ 0x02 ] 2
            Item(Main  ): Input, data= [ 0x02 ] 2
                            Data Variable Absolute No_Wrap Linear
                            Preferred_State No_Null_Position Non_Volatile Bitfield
            Item(Main  ): End Collection, data=none
            Item(Main  ): End Collection, data=none
            Item(Global): Usage Page, data= [ 0x0d ] 13
                            Digitizer
            Item(Local ): Usage, data= [ 0x06 ] 6
                            White Board
            Item(Global): Logical Minimum, data= [ 0x00 ] 0
            Item(Global): Logical Maximum, data= [ 0xff 0x00 ] 255
            Item(Main  ): Collection, data= [ 0x01 ] 1
                            Application
            Item(Global): Report ID, data= [ 0x02 ] 2
            Item(Local ): Usage, data= [ 0x00 ] 0
                            Undefined
            Item(Global): Report Size, data= [ 0x08 ] 8
            Item(Global): Report Count, data= [ 0x11 ] 17
            Item(Main  ): Input, data= [ 0x02 0x01 ] 258
                            Data Variable Absolute No_Wrap Linear
                            Preferred_State No_Null_Position Non_Volatile Buffered Bytes
            Item(Local ): Usage, data= [ 0x00 ] 0
                            Undefined
            Item(Global): Report Size, data= [ 0x08 ] 8
            Item(Global): Report Count, data= [ 0x11 ] 17
            Item(Main  ): Output, data= [ 0x02 0x01 ] 258
                            Data Variable Absolute No_Wrap Linear
                            Preferred_State No_Null_Position Non_Volatile Buffered Bytes
            Item(Main  ): End Collection, data=none
      Endpoint Descriptor:
        bLength                 7
        bDescriptorType         5
        bEndpointAddress     0x81  EP 1 IN
        bmAttributes            3
          Transfer Type            Interrupt
          Synch Type               None
          Usage Type               Data
        wMaxPacketSize     0x0020  1x 32 bytes
        bInterval               1
      Endpoint Descriptor:
        bLength                 7
        bDescriptorType         5
        bEndpointAddress     0x02  EP 2 OUT
        bmAttributes            3
          Transfer Type            Interrupt
          Synch Type               None
          Usage Type               Data
        wMaxPacketSize     0x0020  1x 32 bytes
        bInterval              10
Device Status:     0x0000
  (Bus Powered)
